commit	uc_throughput_msgs	knee_rate	p99_at_knee_ms	lincheck_passed	status	description
-	153.1	100	13.279231	true	discard	api_batch_linger_ms=2 — worse (153 vs 204 baseline), p99 2x; batch not filling (arrival-gated)
d0c7856	1995.7	1000	12.107775	true	keep	concurrent client_write dispatch (spawn per submit) — 205→1996/s (9.7x), knee 100→1000/s; lincheck green
1ad22fd	4467.5	2000	29.589503	true	keep	api_batch_linger_ms=2 (batches now fill via concurrent dispatch) — 1996→4468/s (2.24x), knee 1000→2000/s
77c5d7d	5789.8	5000	75.235327	true	keep	api_batch_linger_ms=5 — 4468→5790/s (+30%), knee 2000→5000/s; low-load p99 9→18ms tradeoff
-	4640.8	2000	35.225599	true	discard	api_batch_linger_ms=10 — regression vs linger=5 (4641<5790), low-load p99 25ms; 5 is the optimum
